### ISSUE TITLE
ICE Negotiation is really slow

### ISSUE THREAD

**Issue by stazio** [paullouisageneau/libjuice#67]
I recently brought libdatachannel up-to-date with master and ICE negotiation is super slow now, on some connections. It can take up to ten seconds to negotiate a pair, whereas before it would be near-instant. I am always in an environment where both endpoints are NATted. This is happening on both Firefox and Chrome. The weird thing is that it is only happening on my internet connection, and only with this latest version. Changing `MAX_STUN_RETRANSMISSION_COUNT` to 1 helps, but I have no idea the consequence of such a change :sweat_smile:.

**Comment by paullouisageneau** [comment]
OK, could you link the verbose log of a session with such a delay please?

Lowering `MAX_STUN_RETRANSMISSION_COUNT` might reduce reliability but locally it should still be fine.

**Comment by stazio** [comment]
I do apologies for how long it took to get this log.
[trace.log](https://github.com/paullouisageneau/libjuice/files/5762961/trace.log)

Would it be possible to add functionality that allows one to filter out, and/or, even provide custom candidates? It's just with my use-case (server-to-browser), I know for a fact that the IP address of my interface is never going to be accessible by any of the peers.

**Comment by stazio** [comment]
So it definitely has something to do with the way the browser deals with the remote candidates. If I filter out the host candidate from the SDP and only use the reflexive one, then it always connects instantly.

**Comment by paullouisageneau** [comment]
Yes, it's still not clear for me what happens exactly but the browser (which has the controlled role here) seems to ignore the candidate nominated by libjuice for some reason and continues probing higher-priority host candidates.

**Comment by stazio** [comment]
If it helps, I wait untill all candidates are gathered before calling `PeerConnection::localDescription` and sending the result of that to the browser.

**Comment by stazio** [comment]
So #70 mitigates this issue for me for the time being. However, if there is anything you want me to try, whether it's traffic control, or whatnot, I can help out when I have the time.

**Comment by paullouisageneau** [comment]
So this is the way it unfolds:  the browser has two local addresses for which it generates two host candidates `10.76.2.107:40548` and `10.76.1.250:55233`, plus TCP candidates which are ignored, and it seems to lack a STUN server. For some reason, libjuice receives incoming browser probes from a third address and the browser answers when libjuice probes the third address, but it doesn't on the two host addresses. However, the browser can strangely reach libjuice from these two addresses, even if the answers from libjuice are probably lost. As a result, libjuice nominates the pair with the this address. However, the browser still waits for the host candidates to timeout to start the DTLS handshake.

I'm still puzzled by how it worked before. It is the same behavior with both Firefox and Chrome? Could you please provide the same log for a previous working libjuice version?

**Comment by stazio** [comment]
I purposefully do not add a stun server on the browser side. The way my network is setup is that `10.76.1.1` is a router with a public IP address, and `10.76.2.1` is another router that is connected to `10.76.1.1`. My laptop is connected to both routers which is why it got both of those host candidates. libjuice is located in the cloud with it's own NAT and the host browser candidates cannot talk to the host libjuice candidates and vice-versa.

I can't actually reproduce this on Firefox anymore, but it is still constant on Chrome.

I don't have any servers available at the moment for me to be able to find you an old verbose log, however, I looked at a tcpdump of the start of a connection. I first send a couple of packets and they are all met with a response in quick succession. I then send many 96 byte long packets to libjuice for several seconds (from/to the same port) and getting no reply until i finally do and almost immediately after that the connection establishes.

'''
StazXPS.60812 > 172.31.67.173.9872: UDP, length 96
StazXPS.60812 > [libjuice public ip].9872: UDP, length 96
[libjuice public ip].9872 > StazXPS.60812: UDP, length 100
StazXPS.60812 > [libjuice public ip].9872: UDP, length 64
[libjuice public ip].9872 > StazXPS.60812: UDP, length 104
StazXPS.60812 > [libjuice public ip].9872: UDP, length 64
StazXPS.60812 > [libjuice public ip].9872: UDP, length 96
StazXPS.55822 > 172.31.67.173.9872: UDP, length 96
StazXPS.55822 > [libjuice public ip].9872
StazXPS.60812 > 172.31.67.173.9872: UDP, length 96
StazXPS.60812 > [libjuice public ip].9872: UDP, length 96

The following happen many times:
16:40:13.127659 IP StazXPS.55822 > 172.31.67.173.9872: UDP, length 96
16:40:13.176023 IP StazXPS.55822 > [libjuice public ip].9872: UDP, length 96
16:40:13.224351 IP StazXPS.60812 > 172.31.67.173.9872: UDP, length 96
16:40:13.272732 IP StazXPS.60812 > [libjuice public ip].9872: UDP, length 96
16:40:13.321063 IP StazXPS.55822 > 172.31.67.173.9872: UDP, length 96

16:40:16.386489 IP [libjuice public ip].9872 > StazXPS.60812: UDP, length 76
StazXPS.60812 > [libjuice public ip].9872: UDP, length 159
RTP traffic starts flowing
'''

I don't know if that's helpful but it looks suspicious to me.

**Comment by paullouisageneau** [comment]
Thanks, this is very interesting indeed!

This is the browser probing both addresses (only the one on the public address will arrive):
```
StazXPS.60812 > [libjuice private ip].9872: UDP, length 96
StazXPS.60812 > [libjuice public ip].9872: UDP, length 96
```
Problem: libjuice answer is missing.

This is libjuice probing the public address of the browser it just learned:
```
[libjuice public ip].9872 > StazXPS.60812: UDP, length 100
StazXPS.60812 > [libjuice public ip].9872: UDP, length 64
```
Since the browsers answered, it nominates the public address:
```
[libjuice public ip].9872 > StazXPS.60812: UDP, length 104
StazXPS.60812 > [libjuice public ip].9872: UDP, length 64
```
Here, ICE is connected from the point of view of libjuice, however the browser continues probing:
```
StazXPS.60812 > [libjuice public ip].9872: UDP, length 96
StazXPS.55822 > [libjuice private ip].9872: UDP, length 96
StazXPS.55822 > [libjuice public ip].9872
StazXPS.60812 > [libjuice private ip].9872: UDP, length 96
StazXPS.60812 > [libjuice public ip].9872: UDP, length 96
```
The problem is that answers to the probe on the public address are silently dropped somewhere, that's why the browser does not consider ICE connected, until it works at some point:

```
[libjuice public ip].9872 > StazXPS.60812: UDP, length 76
StazXPS.60812 > [libjuice public ip].9872: UDP, length 159
```

The problem is probably linked to the send function in libjuice, I'll investigate further.

**Comment by paullouisageneau** [comment]
Something puzzling me is that apart from the probes that are successfully answered, it looks like libjuice receives them with the private addresses from the browser whereas they all should be NATed and have the public address of the `10.76.1.1` router. How could it be?

**Comment by stazio** [comment]
I'm gonna be honest, I totally forgot about this issue until I just saw it again.

I haven't seen this happen again in a long time now as it just suddenly disappeared. I have been using the same setup and I do not believe I made any relevant change to my configuration so I am just gonna close this out.
